{
  "$schema": "https://json-schema.org/draft/2020-12/schema",
  "$id": "https://tikfood.local/schemas/feature-request.schema.json",
  "title": "FeatureRequest",
  "type": "object",
  "additionalProperties": false,
  "required": [
    "feature_id",
    "repo",
    "base_branch",
    "title",
    "description",
    "acceptance_criteria",
    "mode"
  ],
  "properties": {
    "feature_id": { "type": "string", "minLength": 1 },
    "repo": { "type": "string", "minLength": 1 },
    "base_branch": { "type": "string", "minLength": 1 },
    "title": { "type": "string", "minLength": 1 },
    "description": { "type": "string", "minLength": 1 },
    "acceptance_criteria": {
      "type": "array",
      "minItems": 1,
      "items": { "type": "string" }
    },
    "mode": {
      "type": "string",
      "enum": ["feature", "review", "dry_run"]
    }
  }
}
